NCT Number,Study Title,Study URL,Acronym,Study Status,Brief Summary,Study Results,Conditions,Interventions,Primary Outcome Measures,Secondary Outcome Measures,Other Outcome Measures,Sponsor,Collaborators,Sex,Age,Phases,Enrollment,Funder Type,Study Type,Study Design,Other IDs,Start Date,Primary Completion Date,Completion Date,First Posted,Results First Posted,Last Update Posted,Locations,Study Documents
NCT01013285,"Bevacizumab, Temozolomide, and External Beam Radiation Therapy as First-Line Therapy in Treating Patients With Newly Diagnosed Glioblastoma Multiforme or Gliosarcoma",https://clinicaltrials.gov/study/NCT01013285,,COMPLETED,"RATIONALE: Monoclonal antibodies, such as bevacizumab, can block tumor growth in different ways. Some block the ability of tumor cells to grow and spread. Others find tumor cells and help kill them or carry tumor-killing substances to them. Bevacizumab may also stop the growth of tumor cells by blocking blood flow to the tumor. Drugs used in chemotherapy, such as temozolomide, work in different ways to stop the growth of tumor cells, either by killing the cells or by stopping them from dividing. Radiation therapy uses high energy x-rays to kill tumor cells. Giving bevacizumab together with temozolomide and radiation therapy may kill more tumor cells.

PURPOSE: This phase II trial is studying the side effects and how well giving bevacizumab together with temozolomide and external beam radiation therapy works when given as first-line therapy in treating patients with newly diagnosed glioblastoma multiforme or gliosarcoma.",YES,Brain and Central Nervous System Tumors,BIOLOGICAL: bevacizumab|DRUG: temozolomide|RADIATION: external beam radiation therapy,"Overall Survival, 2 years","Time to Disease Progression, Progression is defined using Response Evaluation Criteria In Solid Tumors Criteria (RECIST v1.0), as a 20% increase in the sum of the longest diameter of target lesions, or a measurable increase in a non-target lesion, or the appearance of new lesions., 2 years|Progression-free Survival at 6 Months, participants who were alive and disease progression free at 6 months, 6 months|Radiographic Response (When Evaluable), Radiation therapy (RT) median from diagnosis to RT. Patients will have brain MRI evaluation of response and progression every 8 weeks starting from the day 56 scan obtained 2 weeks after completion of radiation and daily temozolomide and assessment will be conducted on a 7-point scale. This scale is expected to be more useful in this study because many newly-diagnosed patients are likely not to have evaluable disease due to gross total resections. Determination of whether progression occurs based on the day 56 scan will take into account the untreated window between baseline MRI and day of 1 of study.

7 Point Likert Scale: 3 to -3, 3 means complete resolution of tumor, and -3 means new lesion. A -2 or -3 assessment will be taken as tumor progression.

complete resolution of tumor: 3

tumor resolved 3 tumor definitely smaller: 2 tumor probably smaller: 1 tumor unchanged: 0 tumor probably worse: -1 tumor definitely worse: -2 New Lesion: -3, 2 years|Median Overall Survival (OS) Based on the MGMT Promoter Methylation Status, IDH1 and MGMT methylation are important independent prognostic biomarkers that have to be included in a Cox regression model. In addition, subgroup analysis could reveal differential sensitivities to the treatment arm. The MGMT promoter methylation status, IDH1 mutation status were not available for all of the control samples. Therefore, only the samples with both info available were included in the analysis. Baseline analysis results are included in the Baseline Characteristics module., 2 years",,Jonsson Comprehensive Cancer Center,,ALL,"ADULT, OLDER_ADULT",PHASE2,70,OTHER,INTERVENTIONAL,Allocation: NA | Intervention Model: SINGLE_GROUP | Masking: NONE | Primary Purpose: TREATMENT,11-000558|UCLA-0604016|AVF3770s|CDR0000628787|GENENTECH-UCLA-0604016,2006-06,2013-10,2015-08,2009-11-13,2020-09-21,2020-09-21,"Jonsson Comprehensive Cancer Center, University of California, Los Angeles (UCLA), Los Angeles, California, 90095-1781, United States",
NCT04837885,Intra-arterial Hepatic (IAH) Infusion of Radiolabelled Somatostatin Analogs in GEP-NET Patients With Dominant Liver Metastases,https://clinicaltrials.gov/study/NCT04837885,LUTARTERIAL,RECRUITING,"The management of liver metastases in neuroendocrine neoplasms is challenging. Peptide receptor radionuclide therapy with radiolabeled somatostatin analogs (SSA) is one of the most promising therapeutic options. As liver is the most frequent site of metastatic disease, our project proposes to compare administration of radiolabeled SSA by arterial intrahepatic infusion (experimental approach) vs intravenous administration (conventional). Evaluation will be made by (i) comparing 68Ga-DOTA-peptides uptake after intra-hepatic versus intravenous route (imaging), (ii) by evaluating the safety of an additional intra-hepatic administration of therapeutic radiolabeled SSA (therapy).",NO,Neuroendocrine Tumor|Liver Metastases|Neuroendocrine Gastroenteropancreatic Tumour,PROCEDURE: Positron emission tomography computed tomography (PET/CT) with Intra-hepatic (IAH) injection|PROCEDURE: Positron emission tomography computed tomography (PET/CT) with Intravenous (IV) injection|DRUG: LUTATHERA® by intra-arterial hepatic (IAH) injection|PROCEDURE: Scan,"Standardized uptake value (SUVmax) on liver metastases, Standardized uptake value (SUVmax) on liver metastase obtained on PET/CT imaging after injection of 68Ga-DOTA-peptides, Day 0 (First PET/CT)|Standardized uptake value (SUVmax) on liver metastases, Standardized uptake value (SUVmax) on liver metastase obtained on PET/CT imaging after injection of 68Ga-DOTA-peptides, Day 3 (second PET/CT)","Standardized uptake value (SUVmax) on healthy liver, Standardized uptake value (SUVmax) on healthy liver obtained on PET/CT imaging after injection of 68Ga-DOTA-peptides, Day 0 (First PET/CT)|Standardized uptake value (SUVmax) on healthy liver, Standardized uptake value (SUVmax) on healthy liver obtained on PET/CT imaging after injection of 68Ga-DOTA-peptides, Day 3 (second PET/CT)|Standardized uptake value (SUVmax) on kidneys, Standardized uptake value (SUVmax) on kidneys obtained on PET/CT imaging after injection of 68Ga-DOTA-peptides, Day 0 (First PET/CT)|Standardized uptake value (SUVmax) on kidneys, Standardized uptake value (SUVmax) on kidneys obtained on PET/CT imaging after injection of 68Ga-DOTA-peptides, Day 3 (second PET/CT)|Standardized uptake value (SUVmax) on bone marrow, Standardized uptake value (SUVmax) on bone marrow obtained on PET/CT imaging after injection of 68Ga-DOTA-peptides, Day 0 (First PET/CT)|Standardized uptake value (SUVmax) on bone marrow, Standardized uptake value (SUVmax) on bone marrow obtained on PET/CT imaging after injection of 68Ga-DOTA-peptides, Day 3 (second PET/CT)|Standardized uptake value (SUVmax) on spleen, Standardized uptake value (SUVmax) on spleen obtained on PET/CT imaging after injection of 68Ga-DOTA-peptides, Day 0 (First PET/CT)|Standardized uptake value (SUVmax) on spleen, Standardized uptake value (SUVmax) on spleen obtained on PET/CT imaging after injection of 68Ga-DOTA-peptides, Day 3 (second PET/CT)|Standardized uptake value (SUVmax) on associated extra-hepatic metastases, Standardized uptake value (SUVmax) on associated extra-hepatic metastases obtained on PET/CT imaging after injection of 68Ga-DOTA-peptides, Day 0 (First PET/CT)|Standardized uptake value (SUVmax) on associated extra-hepatic metastases, Standardized uptake value (SUVmax) on associated extra-hepatic metastases obtained on PET/CT imaging after injection of 68Ga-DOTA-peptides, Day 3 (second PET/CT)|177Lu-DOTA-peptide dosimetry, Absorbed dose in different tissue of the 5 hepatic targets, possible extra-hepatic lesions and healthy organs (healthy liver, kidney, bone marrow, spleen), Day 18",,"University Hospital, Bordeaux",Advanced Accelerator Applications,ALL,"ADULT, OLDER_ADULT",PHASE2,23,OTHER,INTERVENTIONAL,Allocation: NA | Intervention Model: SINGLE_GROUP | Masking: NONE | Primary Purpose: TREATMENT,CHUBX 2017/47,2021-09-24,2025-09-24,2027-03-24,2021-04-08,,2025-07-23,"Institut Bergonié, Bordeaux, 33000, France|Institut de cancérologie du Gard (ICG) - CHU de Nîmes, Nîmes, 30029, France|CHU Bordeaux - Hôpital Haut Lévêque, Pessac, 33604, France|Institut universitaire du cancer de Toulouse (IUCT) Oncopole, Toulouse, 31100, France",
NCT00785785,A Study of Nilotinib Versus Imatinib in GIST Patients,https://clinicaltrials.gov/study/NCT00785785,ENESTg1,COMPLETED,This study will evaluate efficacy and safety of nilotinib versus imatinib in adult patients with unresectable or metastatic gastrointestinal stromal tumors (GIST).,YES,Gastrointestinal Stromal Tumor (GIST),DRUG: Nilotinib (AMN107)|DRUG: imatinib (STI571),"Time to Progression Free Survival (PFS), PFS was defined as the time from the date of start of treatment to the date of the first documented progression or death due to any cause. Progression is defined as a 20% increase in the sum of the longest diameter of target lesions, or a measurable increase in a non-target lesion, or the appearance of new lesions, up to month 37",,,Novartis Pharmaceuticals,,ALL,"ADULT, OLDER_ADULT",PHASE3,644,INDUSTRY,INTERVENTIONAL,Allocation: RANDOMIZED | Intervention Model: CROSSOVER | Masking: NONE | Primary Purpose: TREATMENT,CAMN107G2301|2008-004758-34,2009-03,2014-10,2014-10,2008-11-05,2016-04-07,2016-06-16,"Birmingham Hematology and Oncology Associates, Birmingham, Alabama, 35205, United States|Northern Arizona Hematology/Oncology Associates, P.C. Dept. of No. AZ Hem-Onc, Flagstaff, Arizona, 86001, United States|City of Hope National Medical Center Dept.ofCityofHopeMedicalCtr(4), Duarte, California, 91010-3000, United States|City of Hope National Medical Center Regulatory Document, Duarte, California, 91010-3000, United States|University of California San Diego - Moores Cancer Center Dept of Moores Cancer Ctr (2), La Jolla, California, 92093-0658, United States|University of California at Los Angeles GI Oncology Program, Los Angeles, California, 90095, United States|Stanford University Medical Center Stanford Cancer Center, Stanford, California, 94304, United States|University of Colorado Dept. of Univ. of Colorado, Aurora, Colorado, 80045, United States|Rocky Mountain Cancer Centers Dept. of Rocky Mountain Cancer, Greenwood Village, Colorado, United States|Washington Hospital Center Wash Hospital, Washington D.C., District of Columbia, 20010, United States|Ocala Oncology Center Dept. of Ocala Oncology Center, Ocala, Florida, 34474, United States|Kootenai Medical Center Dept.ofKootenai Med.Ctr., Coeur d'Alene, Idaho, 83814, United States|Northwestern University Clinical Research Office (2), Chicago, Illinois, 60611, United States|Dana Farber Cancer Institute Centerfor Sarcoma&BoneOncology, Boston, Massachusetts, 02215, United States|University of Michigan Comprehensive Cancer Center DeptofMichiganCancerCenter(6), Ann Arbor, Michigan, 48109-0944, United States|Minnesota Oncology Hematology, P.A. SC, Minneapolis, Minnesota, 55404, United States|Mayo Clinic - Rochester Division of Hematology, Rochester, Minnesota, 55905, United States|New York Oncology Hematology, P.C. NYOH Amsterdam, Troy, New York, 12180, United States|New York Oncology Hematology, P.C. NYOH@AlbanyMedicalCenter(2), Troy, New York, 12180, United States|University of Pennsylvania Medical Center CAMN107G2301, Philadelphia, Pennsylvania, 19104-4283, United States|Vanderbilt Univeristy Ingram Cancer Ctr., Nashville, Tennessee, 37232, United States|Texas Oncology, P.A. Tex Onc (2), Bedford, Texas, 76022, United States|Texas Oncology Wichita Falls, Dallas, Texas, 75246, United States|University of Texas Southwestern Medical Center DeptofSimmons Cancer Center(3), Dallas, Texas, 75390-8527, United States|University of Texas/MD Anderson Cancer Center Dept. of MD Anderson (13), Houston, Texas, 77030-4009, United States|Cancer Care Centers of South Texas / HOAST CCC of So. TX- San Antonio(2), San Antonio, Texas, 78229, United States|Tyler Cancer Center Dept.ofTylerCancerCtr. (2), Tyler, Texas, 75702, United States|University of Utah / Huntsman Cancer Institute Dept.ofHuntsmanCancerInst.(3), Salt Lake City, Utah, 84112, United States|Novartis Investigative Site, Buenos Aires, Buenos Aires, C1264AAA, Argentina|Novartis Investigative Site, Caba, Buenos Aires, C1426ANZ, Argentina|Novartis Investigative Site, Rosario, Santa Fe Province, S2000PBH, Argentina|Novartis Investigative Site, Innsbruck, Tyrol, 6020, Austria|Novartis Investigative Site, Graz, 8036, Austria|Novartis Investigative Site, Leoben, A-8700, Austria|Novartis Investigative Site, Vienna, A-1090, Austria|Novartis Investigative Site, Wels, 4600, Austria|Novartis Investigative Site, Uberlândia, Minas Gerais, 38408-150, Brazil|Novartis Investigative Site, Florianópolis, Santa Catarina, 88034-000, Brazil|Novartis Investigative Site, Campinas, São Paulo, 13083-970, Brazil|Novartis Investigative Site, São Paulo, São Paulo, 04023-900, Brazil|Novartis Investigative Site, Sofia, 1784, Bulgaria|Novartis Investigative Site, Varna, 9010, Bulgaria|Novartis Investigative Site, Vancouver, British Columbia, V5Z 4E6, Canada|Novartis Investigative Site, Halifax, Nova Scotia, B3H 1V7, Canada|Novartis Investigative Site, Hamilton, Ontario, L8V 5C2, Canada|Novartis Investigative Site, Ottawa, Ontario, K1H 8L6, Canada|Novartis Investigative Site, Toronto, Ontario, M5G1X5, Canada|Novartis Investigative Site, Montreal, Quebec, H1T 2M4, Canada|Novartis Investigative Site, Montreal, Quebec, H3A 1A1, Canada|Novartis Investigative Site, Québec, Quebec, G1R 2J6, Canada|Novartis Investigative Site, Beijing, Beijing Municipality, 100730, China|Novartis Investigative Site, Nanjing, Jiangsu, 210002, China|Novartis Investigative Site, Beijing, 100036, China|Novartis Investigative Site, Guangzhou, 510060, China|Novartis Investigative Site, Shanghai, 200032, China|Novartis Investigative Site, Shanghai, 200433, China|Novartis Investigative Site, Pereira, Colombia|Novartis Investigative Site, Olomouc, 775 20, Czechia|Novartis Investigative Site, Århus C, DK-8000, Denmark|Novartis Investigative Site, Herlev, DK-2730, Denmark|Novartis Investigative Site, Alexandria, Egypt|Novartis Investigative Site, Cairo, Egypt|Novartis Investigative Site, Bordeaux, 33076, France|Novartis Investigative Site, Chambray-lès-Tours, 37170, France|Novartis Investigative Site, Lyon, 69373, France|Novartis Investigative Site, Marseille, 13385, France|Novartis Investigative Site, Paris, 75651, France|Novartis Investigative Site, Saint-Herblain Cédex, 44805, France|Novartis Investigative Site, Toulouse, 31054, France|Novartis Investigative Site, Vandœuvre-lès-Nancy, 54511, France|Novartis Investigative Site, Villejuif, 94805, France|Novartis Investigative Site, Bad Saarow, 15526, Germany|Novartis Investigative Site, Düsseldorf, 40479, Germany|Novartis Investigative Site, Essen, 45122, Germany|Novartis Investigative Site, Hanover, 30625, Germany|Novartis Investigative Site, Mannheim, 68167, Germany|Novartis Investigative Site, München, 81377, Germany|Novartis Investigative Site, Weiden, 92637, Germany|Novartis Investigative Site, Hong Kong SAR, Hong Kong|Novartis Investigative Site, Budapest, 1062, Hungary|Novartis Investigative Site, Budapest, 1097, Hungary|Novartis Investigative Site, Haifa, 3525408, Israel|Novartis Investigative Site, Ramat Gan, 5266202, Israel|Novartis Investigative Site, Bologna, BO, 40138, Italy|Novartis Investigative Site, San Giovanni Rotondo, FG, 71013, Italy|Novartis Investigative Site, Florence, FI, 50134, Italy|Novartis Investigative Site, Genova, GE, 16132, Italy|Novartis Investigative Site, Milan, MI, 20133, Italy|Novartis Investigative Site, Modena, MO, 41100, Italy|Novartis Investigative Site, Palermo, PA, 90127, Italy|Novartis Investigative Site, Aviano, PN, 33081, Italy|Novartis Investigative Site, Candiolo, TO, 10060, Italy|Novartis Investigative Site, Torino, TO, 10153, Italy|Novartis Investigative Site, Nagoya, Aichi-ken, 464-8681, Japan|Novartis Investigative Site, Kashiwa, Chiba, 277-8577, Japan|Novartis Investigative Site, Fukuoka, Fukuoka, 812-8582, Japan|Novartis Investigative Site, Gifu, Gifu, 501-1194, Japan|Novartis Investigative Site, Sapporo, Hokkaido, 060-8648, Japan|Novartis Investigative Site, Yokohama, Kanagawa, 241-8515, Japan|Novartis Investigative Site, Kumamoto, Kumamoto, 860-8556, Japan|Novartis Investigative Site, Sendai, Miyagi, 980-8574, Japan|Novartis Investigative Site, Niigata, Niigata, 951-8520, Japan|Novartis Investigative Site, Kurashiki, Okayama-ken, 701-0192, Japan|Novartis Investigative Site, Osaka, Osaka, 540-0006, Japan|Novartis Investigative Site, Suita, Osaka, 565-0871, Japan|Novartis Investigative Site, Sunto-gun, Shizuoka, 411-8777, Japan|Novartis Investigative Site, Chuo-ku, Tokyo, 104-0045, Japan|Novartis Investigative Site, Toyama, Toyama, 930-0194, Japan|Novartis Investigative Site, Chihuahua City, Chihuahua, 31000, Mexico|Novartis Investigative Site, León, Guanajuato, 37000, Mexico|Novartis Investigative Site, Mexico City, Mexico City, 14080, Mexico|Novartis Investigative Site, Leiden, 2300 RC, Netherlands|Novartis Investigative Site, Oslo, NO-0310, Norway|Novartis Investigative Site, Krakow, 31-501, Poland|Novartis Investigative Site, Warsaw, 02-781, Poland|Novartis Investigative Site, Craiova, Dolj, 200535, Romania|Novartis Investigative Site, Bucharest, 022328, Romania|Novartis Investigative Site, Cluj-Napoca, 3400, Romania|Novartis Investigative Site, Iași, 700106, Romania|Novartis Investigative Site, Kazan', Tatarstan Republic, 420029, Russia|Novartis Investigative Site, Moscow, 115478, Russia|Novartis Investigative Site, Saint Petersburg, 198255, Russia|Novartis Investigative Site, Yekaterinburg, 620036, Russia|Novartis Investigative Site, Singapore, Singapore, 119228, Singapore|Novartis Investigative Site, Singapore, Singapore, 169610, Singapore|Novartis Investigative Site, Bratislava, Slovak Republic, 83310, Slovakia|Novartis Investigative Site, Cape Town, 7500, South Africa|Novartis Investigative Site, Johannesburg, 2199, South Africa|Novartis Investigative Site, Pretoria, 0001, South Africa|Novartis Investigative Site, Pretoria, 0002, South Africa|Novartis Investigative Site, Pretoria, 0027, South Africa|Novartis Investigative Site, Suwon, Gyeonggi-do, 443-380, South Korea|Novartis Investigative Site, Seoul, Korea, 05505, South Korea|Novartis Investigative Site, Seoul, Korea, 06351, South Korea|Novartis Investigative Site, Barcelona, Barcelona, 08041, Spain|Novartis Investigative Site, Sabadell, Barcelona, 08208, Spain|Novartis Investigative Site, Madrid, Madrid, 28046, Spain|Novartis Investigative Site, Oviedo, Principality of Asturias, 33006, Spain|Novartis Investigative Site, Gothenburg, SE-413 45, Sweden|Novartis Investigative Site, Linköping, SE-581 85, Sweden|Novartis Investigative Site, Lund, SE-221 85, Sweden|Novartis Investigative Site, Stockholm, SE-171 76, Sweden|Novartis Investigative Site, Umeå, SE-901 85, Sweden|Novartis Investigative Site, Uppsala, SE-751 85, Sweden|Novartis Investigative Site, Niaosong Township, Taiwan, 83301, Taiwan|Novartis Investigative Site, Taipei, Taiwan, 10002, Taiwan|Novartis Investigative Site, Taipei, Taiwan, ROC, 112, Taiwan|Novartis Investigative Site, Linkou District, 33305, Taiwan|Novartis Investigative Site, Bangkok, 10330, Thailand|Novartis Investigative Site, Bangkok, 10700, Thailand|Novartis Investigative Site, Khon Kaen, 40002, Thailand|Novartis Investigative Site, Songkhla, 90110, Thailand|Novartis Investigative Site, Adana, Turkey, 01330, Turkey (Türkiye)|Novartis Investigative Site, Ankara, Turkey, 06100, Turkey (Türkiye)|Novartis Investigative Site, Ankara, Turkey, 06500, Turkey (Türkiye)|Novartis Investigative Site, Izmir, Turkey, 35040, Turkey (Türkiye)|Novartis Investigative Site, Balcova / Izmir, 35340, Turkey (Türkiye)|Novartis Investigative Site, Kartal, 34890, Turkey (Türkiye)|Novartis Investigative Site, Newcastle upon Tyne, Newcastle-upon-Tyne, NE7 7DN, United Kingdom|Novartis Investigative Site, Cambridge, CB2 2QQ, United Kingdom|Novartis Investigative Site, Glasgow, G12 0YN, United Kingdom|Novartis Investigative Site, London, NW1 2BU, United Kingdom|Novartis Investigative Site, London, SW3 6JJ, United Kingdom|Novartis Investigative Site, Manchester, M20 4BX, United Kingdom|Novartis Investigative Site, Caracas, Distrito Federal, 1010, Venezuela",
NCT03265743,HPV Vaccination in Women With Cystic Fibrosis,https://clinicaltrials.gov/study/NCT03265743,VACCIN-HPV-MUC,COMPLETED,"The main risk factor for the development of cervical lesions is human papillomavirus (HPV) infection. Vaccination against human papillomavirus, which is offered to all girls aged 11 to 14, and catching up to girls aged 15 to 19, is an effective method of preventing cervical pathology. Despite this, human papillomavirus vaccination coverage remains low in France.

Some women with cystic fibrosis might need a transplantation, which is a factor associated with increased risk of human papillomavirus carriage and cervical pathology. An over-risk of cervical pathology would also be present in non-transplanted women with cystic fibrosis. Particular attention should therefore be paid to vaccination in this population.

The objective is to estimate the frequency of human papillomavirus vaccination in young patients with cystic fibrosis, and to evaluate the reasons for non-vaccination.",NO,Human Papillomavirus Infection,OTHER: Self-report Written Questionnaire,"Realization of human papillomavirus vaccination, The main outcome is the prevalence of human papillomavirus vaccination in young women with Cystic fibrosis.

This data is collected using a questionnaire : HPV vaccination performed : yes/no, 15 minutes","Type of vaccine used, This data is collected using a questionnaire : bivalent (Cervarix®) or quadrivalent (Gardasil®), 15 minutes|Respect for the vaccinal plan, This data is collected using a questionnaire : number and dates of injections, 15 minutes|Reasons for non-vaccination, In case of non-vaccination reasons are collected using a multiple choices questionnaire, 15 minutes",,Hospices Civils de Lyon,,FEMALE,"CHILD, ADULT",,74,OTHER,OBSERVATIONAL,Observational Model: OTHER | Time Perspective: PROSPECTIVE,69HCL17_0277,2017-09-25,2017-12-15,2017-12-15,2017-08-29,,2018-02-19,"Nouvel Hôpital d'Estaing CRCM Mixte, Clermont-Ferrand, 63003, France|CHU Grenoble, Grenoble, 38043, France|Cystic Fibrosis Reference Center, Hospices Civils de Lyon, Pierre-Bénite, 69495, France",
NCT06077643,Workshops and Exchange Groups for Laryngectomized Patients,https://clinicaltrials.gov/study/NCT06077643,GELAT,RECRUITING,"This research is conducted with the aim of improving the quality of life of laryngectomized patients and their entourage. Worldwide, there are 185,000 new cases of laryngeal cancer per year. In Europe, between 2000 and 2007, the crude annual incidence rates of these cancers were 4.6/100,000 with a 5-year survival rate of 61%.

In France, about 30 to 35% of cancers of the upper aerodigestive tract are localized to the larynx, or about 43,000 cases per year. Most patients are men (89%) between 50 and 70 years old. One of the treatments for these cancers is to perform an excision of the larynx thus removing the entire tumor, it is the total laryngectomy. The trachea is thus permanently removed from the skin and the digestive tract becomes independent.",NO,Laryngectomy; Status|Laryngeal Cancer,,"Differences in quality of life scores before and after the program, between the program and non-program control groups., The aim is to show a difference in patients' overall quality of life scores via the WHOQOL-BREF questionnaire, before and after the program., 4 months","For overall quality of life using the WHOQOL-BREF questionnaire, comparison of the average patient scores, before and after exchange groups., The aim is to show a difference in patients' overall quality of life scores via the WHOQOL-BREF questionnaire, before and after the program., 4 months|For ENT-specific quality of life using the EORTC QLQH&n43 questionnaire, comparison of the average patient scores, before and after exchange groups., The aim is to show a difference in quality of life scores specific to ENT EORTC QLQH\&n43, before and after the program., 4 months|Evaluation of the participation rate (number of patients present out of the number of patients enrolled), during each session via the OVET software., 4 months",,Assistance Publique - Hôpitaux de Paris,,ALL,"ADULT, OLDER_ADULT",,50,OTHER,OBSERVATIONAL,Observational Model: COHORT | Time Perspective: PROSPECTIVE,APHP230743,2023-10-10,2026-06-10,2026-10-10,2023-10-11,,2026-03-27,"Bichat - Claude Bernard Hospital, Paris, 75018, France",
