NCT Number,Study Title,Study URL,Acronym,Study Status,Brief Summary,Study Results,Conditions,Interventions,Primary Outcome Measures,Secondary Outcome Measures,Other Outcome Measures,Sponsor,Collaborators,Sex,Age,Phases,Enrollment,Funder Type,Study Type,Study Design,Other IDs,Start Date,Primary Completion Date,Completion Date,First Posted,Results First Posted,Last Update Posted,Locations,Study Documents
NCT01907789,Prophylactic Salpingectomy With Delayed Oophorectomy,https://clinicaltrials.gov/study/NCT01907789,,ACTIVE_NOT_RECRUITING,"The goal of this clinical research study is to compare ovarian cancer screening, risk-reducing salpingo-oophorectomy (RRSO), and prophylactic salpingectomy with delayed oophorectomy (PSDO). The safety of RRSO and PSDO will also be studied.

Ovarian cancer screening does not involve a surgical procedure. Instead, physical exams, blood tests, and ultrasound are used to check for ovarian, fallopian tube, and peritoneal cancer.

The surgical procedures, RRSO and PSDO, are designed to lower your risk of ovarian cancer.

In RRSO, the fallopian tubes and ovaries are removed at the same time.

In PSDO, the fallopian tubes are removed and the ovaries remain in place so that the patient does not go through menopause. The ovaries are removed at a later date. The main goal of this study is to learn how many patients actually have their ovaries removed at a later date. Researchers also want to learn whether the removal of fallopian tubes will decrease the risk of ovarian cancer.",NO,Ovarian Carcinoma,OTHER: Ovarian Cancer Screening|PROCEDURE: Prophylactic Salpingectomy with Delayed Oophorectomy|PROCEDURE: Risk-Reducing Salpingo-Oophorectomy|BEHAVIORAL: Questionnaire|PROCEDURE: Transvaginal Ultrasound|BEHAVIORAL: Phone Call,"Patient Compliance with Prophylactic Salpingectomy with Delayed Oophorectomy Strategy, The proportion of women who comply with the prophylactic salpingectomy with delayed oophorectomy strategy estimated with an exact 95% binomial confidence interval. If all 20 patients return for their scheduled oophorectomy the 95% confidence interval for the proportion of women who are compliant will be 0.846 to 1.00., Up to 5 years","Number of occult malignancies, Will be tabulated by study arm. The risk difference will be estimated for occult malignancies with 95% confidence intervals, where the risk is defined as the number of events divided by the total time at risk., Up to 5 years|Number of complications, Will be tabulated by study arm. The risk difference will be estimated for complications with 95% confidence intervals, where the risk is defined as the number of events divided by the total time at risk., Up to 5 years|Type of complications, Will be tabulated by study arm. The risk difference will be estimated for complications with 95% confidence intervals, where the risk is defined as the number of events divided by the total time at risk., Up to 5 years|Change in quality of life measure, Descriptive statistics and box plots will be used to summarize the quality of life measures at each assessment time for each study arm., Baseline to up to 3 years",,M.D. Anderson Cancer Center,,FEMALE,ADULT,NA,80,OTHER,INTERVENTIONAL,Allocation: NON_RANDOMIZED | Intervention Model: PARALLEL | Masking: NONE | Primary Purpose: PREVENTION,2013-0340|NCI-2015-00465,2013-08-26,2030-12-31,2030-12-31,2013-07-25,,2026-04-16,"NorthShore University Health System, Evanston, Illinois, 60201, United States|University of Texas MD Anderson Cancer Center, Houston, Texas, 77030, United States",
NCT01795768,Proof-of-Concept Study of AZD4547 in Patients With FGFR1 or FGFR2 Amplified Tumours,https://clinicaltrials.gov/study/NCT01795768,FGFR,UNKNOWN,"To assess the activity of the FGFR inhibitor AZD4547 in patients with FGFR1 or FGFR2 amplified breast, squamous lung and stomach cancer whose cancers have progressed following previous chemotherapy",NO,Gastric Cancer|Oesophageal Cancer|Breast Cancer|Squamous Cell Carcinoma of the Lung,DRUG: AZD 4547,"To assess anti-tumour activity as change in tumour size at 8 weeks and the correlation with change in tumour ERK1/2 phosphorylation at day 10-14., A primary objective of the study is to collect serial research biopsies at baseline and on treatment with AZD4547, to assess the molecular changes that occur in the tumour in response to AZD4547 treatment and correlate with change in tumour size assessed at 8 weeks., Baseline (tumour size, pERK), day 14(pERK), and week 8(tumour size)","Response rate, Response rate is assessed using RECIST 1.1 radiological response and centrally reviewed., Eight weeks from treatment initiation and then every 6 weeks thereafter|Progression free survival, Time measured from baseline to disease progression or death from any cause (approximately 3-9 months)|Disease control rate at eight weeks, Disease control rate will be calculated as the proportion of patients with CR/PR/SD at eight weeks from baseline|Safety and tolerability of AZD4547, Toxicity is assessed from consent until 30 days following treatment cessation",,Royal Marsden NHS Foundation Trust,AstraZeneca,ALL,"ADULT, OLDER_ADULT",PHASE2,48,OTHER,INTERVENTIONAL,Allocation: NON_RANDOMIZED | Intervention Model: SINGLE_GROUP | Masking: NONE | Primary Purpose: TREATMENT,3689,2012-09,2014-09,2015-09,2013-02-21,,2013-03-15,"Royal Marsden NHS Foundation Trust, London and Surrey, Surrey, SM2 5PT, United Kingdom",
NCT07046468,Smart Pill for Measuring Gut Health in Colon Inflammation and Colon Cancer,https://clinicaltrials.gov/study/NCT07046468,SPIRIT,RECRUITING,"The goal of this observational pilot study with invasive measurements is to explore whether an ingestible sensor pill can be of use in diagnosis or monitoring of disease in patients with ulcerative colitis or colorectal cancer. The main questions it aims to answer are:

* which changes in bowel environment can the sensor pill measure in ulcerative colitis and colorectal cancer before and after treatment?
* how practical, effective and user-friendly is the sensor pill for measuring bowel environment in patients with bowel disease?

Participants will:

* take one sensor pill before treatment and take one sensor pill three months after (start of) treatment;
* monitor sensor pill bowel exit using a small wearable device;
* answer a questionnaire on experience with the sensor pill;
* receive an extra bowel ultrasound (non-endoscopic) three months after start of treatment (only for participants with ulcerative colitis).",NO,Ulcerative Colitis (UC)|Colorectal Cancer (CRC),DEVICE: Ingestion of sensor capsule (twice)|BEHAVIORAL: Device evaluation questionnaire|DEVICE: Wearing device|BEHAVIORAL: Monitoring sensor capsule exit|DEVICE: Placement of devices at home|DIAGNOSTIC_TEST: Follow-up intestinal ultrasound,"Intestinal ORP measurements, ORP profile in the colon using the GISMO GEN1 System in patients with UC or CRC., Baseline and at 3 months after start of treatment.|Disease activity (SCCAI), UC disease activity as determined by the Simple Clinical Colitis Activity Index, Baseline and 3 months after start of treatment.|Disease activity (FC), UC disease activity as determined by the faecal calprotectin (in microgram/gram), Baseline and at 3 months after treatment start.|Tumor stage, TNM tumor stage as recorded in pathology report., Directly after surgical resection|Tumor size, Tumor size as recorded in surgery report., Directly after surgical resection|Tumor resection margin status, Residual tumor at the primary site after surgical resection as classified in pathology report., Directly after surgical resection|Tumor differentiation grade, Tumor differentiation grade as recorded in pathology report., Directly after surgical resection","Intestinal pH, Intestinal pH measured with the ingestible sensor capsule., From enrollment to 3 months after start of treatment.|Area of inflammation, Area of inflammation in patients with UC, as recorded in the intestinal ultrasound report., Directly after intestinal ultrasound.|Tumour location, Tumor location in patients with CRC as recorded in the surgery report., Directly post-surgery.|Ingestible transit time., Time from ingestion to defaecation in hours., Baseline and at 3 months after start of treatment.|Data coverage, Data coverage of recordings with the ingestible sensor capsule in minutes of data recorded as percentage of transit time in minutes (%), Baseline and at 3 months after start of treatment|Participant experience, Participant experience determined with a satisfaction questionnaire., Up to 1 month after exit of the post-treatment ingestible sensor capsule measurement period.",,Radboud University Medical Center,Stichting IMEC-NL,ALL,"ADULT, OLDER_ADULT",,10,OTHER,OBSERVATIONAL,Observational Model: COHORT | Time Perspective: PROSPECTIVE,2024-17771|NL88151.091.24,2025-07-01,2026-03-01,2026-05-01,2025-07-01,,2025-08-29,"Radboud university medical center, Nijmegen, Gelderland, 6525GA, Netherlands",
NCT07215650,Clinical Study of Cizutamig in Generalized Myasthenia Gravis (gMG),https://clinicaltrials.gov/study/NCT07215650,,RECRUITING,"The purpose of this study is to assess the safety, tolerability, PK, PD, immunogenicity, and preliminary clinical activity of Cizutamig in patients with Generalized Myasthenia Gravis.",NO,Generalized Myasthenia Gravis,DRUG: Cizutamig,"Incidence and severity of treatment-emergent adverse events through end of study, Baseline to Month 12|Changes from baseline in vital signs through end of study: body temperature, Baseline to Month 12|Changes from baseline in vital signs through end of study: heart rate, Baseline to Month 12|Changes from baseline in vital signs through end of study: respiratory rate, Baseline to Month 12|Changes from baseline in vital signs through end of study: blood pressure, Baseline to Month 12|Changes from baseline in vital signs through end of study: pulse oximetry, Baseline to Month 12|Changes from baseline in ECG parameters through end of study: PR interval, Baseline to Month12|Changes from baseline in ECG parameters through end of study: QRS interval, Baseline to Month 12|Changes from baseline in ECG parameters through end of study: QTcF interval, Baseline to Month 12|Changes from baseline in safety laboratory assessments through end of study: serum chemistry, Baseline to Month 12|Changes from baseline in safety laboratory assessments through end of study: hematology, Baseline to Month 12","Pharmacokinetic (PK) parameters for Cizutamig: Cmax, Baseline to Month 12|PK parameters for Cizutamig: time of maximum concentration, Baseline to Month 12|PK parameters for Cizutamig: area under the concentration-time curve, Baseline to Month 12|PK parameters for Cizutamig: clearance, Baseline to Month 12|PK parameters for Cizutamig: volume of distribution, Baseline to Month 12|PK parameters for Cizutamig: half-life, Baseline to Month 12",,Candid Therapeutics,,ALL,"ADULT, OLDER_ADULT",PHASE1,44,INDUSTRY,INTERVENTIONAL,Allocation: NA | Intervention Model: SINGLE_GROUP | Masking: NONE | Primary Purpose: TREATMENT,CND106-107,2025-09-16,2027-12,2028-04,2025-10-10,,2025-11-17,"Huashan Hospital Affiliated to Fudan University, Shanghai, Shanghai Municipality, China",
NCT07018050,Phase II Study of QLS32015 Combination Therapy in the Treatment of Multiple Myeloma,https://clinicaltrials.gov/study/NCT07018050,,RECRUITING,"The purpose of the study is to compare the efficacy of QLS32105 (SC) in combination with Pomalidomide, and QLS32105 (SC) in combination with QL2109 or Daratumumab, and QLS32105 (SC) in combination with QL2109 or Daratumumab and Pomalidomide, and QLS32105(SC) in combination with Bortezomib and Lenalidomide.",NO,Relapsed or Refractory Multiple Myeloma,DRUG: QLS32015|DRUG: Pomalidomide|DRUG: Dexamethasone|DRUG: QL2109 or Daratumumab|DRUG: Bortezomib|DRUG: Lenalidomide,"ORR (Partial Response [PR] or Better), Overall response (PR or better) is defined as percentage of participants who have a PR or better per International Myeloma Working Group (IMWG) criteria, Up to 2 years|Overall Minimal Residual Disease (MRD), MRD-negative is defined as proportion of participants who achieve MRD negativity at a threshold of 10\^-5 at any timepoint after the first dose of study drug and before disease progression or start of subsequent antimyeloma therapy, Up to 2 years","Progression-Free Survival (PFS), PFS is defined as time from the date of randomization to the first documentation of disease progression, or death due to any cause, whichever is reported first, Up to 2 years",,"Qilu Pharmaceutical Co., Ltd.",,ALL,"ADULT, OLDER_ADULT",PHASE2,160,INDUSTRY,INTERVENTIONAL,Allocation: NON_RANDOMIZED | Intervention Model: PARALLEL | Masking: NONE | Primary Purpose: TREATMENT,QLS32015-202,2025-09-12,2027-11,2028-07,2025-06-12,,2025-09-22,"Institute of Hematology & Blood Diseases Hospital, Tianjin, China",
