NCT Number,Study Title,Study URL,Acronym,Study Status,Brief Summary,Study Results,Conditions,Interventions,Primary Outcome Measures,Secondary Outcome Measures,Other Outcome Measures,Sponsor,Collaborators,Sex,Age,Phases,Enrollment,Funder Type,Study Type,Study Design,Other IDs,Start Date,Primary Completion Date,Completion Date,First Posted,Results First Posted,Last Update Posted,Locations,Study Documents
NCT01697514,A Study of LY2940680 in Pediatric Medulloblastoma or Rhabdomyosarcoma,https://clinicaltrials.gov/study/NCT01697514,,WITHDRAWN,"The purpose of this study is to find a recommended dose level of LY2940680 that can be safely given to children with medulloblastoma or rhabdomyosarcoma that has returned or doesn't respond to initial treatment. The study will also explore the changes in a cancer marker levels. Finally, the study will help document any antitumor activity.",NO,"Medulloblastoma, Childhood|Rhabdomyosarcoma",DRUG: LY2940680|DRUG: LY2940680,"Maximum Tolerated Dose of LY2940680, Baseline to Part A Completion (estimated as 12 months)","Pharmacokinetics: Area Under the Concentration - Time Curve (AUC) of LY2940680 and LSN2941091, Predose up to 24 hours Postdose|Pharmacokinetics: Maximum Concentration (Cmax) of LY2940680 and LSN2941091, Predose up to 24 hours Postdose|Pharmacokinetics: Time of Maximal Concentration (Tmax) of LY2940680 and LSN2941091, Predose up to 24 hours Postdose|Number of Participants with Tumor Response, Baseline to Study Completion (estimated as 44 months)",,Eli Lilly and Company,,ALL,"CHILD, ADULT",PHASE1,0,INDUSTRY,INTERVENTIONAL,Allocation: NON_RANDOMIZED | Intervention Model: SINGLE_GROUP | Masking: NONE | Primary Purpose: TREATMENT,14492|I4J-MC-HHBD,2013-07,2016-07,2016-07,2012-10-02,,2013-08-27,"For additional information regarding investigative sites for this trial, contact 1-877-CTLILLY (1-877-285-4559, 1-317-615-4559) Mon - Fri from 9 AM to 5 PM Eastern Time (UTC/GMT - 5 hours, EST), or speak with your personal physician., San Diego, California, 92123, United States|For additional information regarding investigative sites for this trial, contact 1-877-CTLILLY (1-877-285-4559, 1-317-615-4559) Mon - Fri from 9 AM to 5 PM Eastern Time (UTC/GMT - 5 hours, EST), or speak with your personal physician., Aurora, Colorado, 80045, United States|For additional information regarding investigative sites for this trial, contact 1-877-CTLILLY (1-877-285-4559, 1-317-615-4559) Mon - Fri from 9 AM to 5 PM Eastern Time (UTC/GMT - 5 hours, EST), or speak with your personal physician., Cincinnati, Ohio, 45229, United States|For additional information regarding investigative sites for this trial, contact 1-877-CTLILLY (1-877-285-4559, 1-317-615-4559) Mon - Fri from 9 AM to 5 PM Eastern Time (UTC/GMT - 5 hours, EST), or speak with your personal physician., Portland, Oregon, 97239, United States",
NCT05158621,A Screening Study Targeting Tumor-specific Antigens,https://clinicaltrials.gov/study/NCT05158621,,COMPLETED,"The purpose of this study is to identify patients who may be eligible to participate in a separate Phase 2/3 treatment study evaluating an individualized neoantigen vaccine GRANITE for first line (1L) maintenance treatment of metastatic, microsatellite-sable colorectal cancer (MSS-CRC) sponsored by Gritstone bio. This may include the manufacturing of an individualized vaccine, which involves neoantigen prediction and generating a vaccine targeting neoantigens.",NO,Metastatic Colorectal Cancer|Stage II/III Colon Cancer,PROCEDURE: blood collection for research (next generation sequencing [NGS])|PROCEDURE: blood collection for research (HLA typing)|PROCEDURE: blood collection for research (circulating tumor DNA [ctDNA]),"Primary, To identify patients with a defined tumor-specific profile (or tumor-specific characteristics, proteins, mutations) for potential inclusion in a separate clinical study that involves investigational study treatment., at study enrollment",,,"Gritstone bio, Inc.",,ALL,"CHILD, ADULT, OLDER_ADULT",,22,INDUSTRY,OBSERVATIONAL,Observational Model: CASE_ONLY | Time Perspective: PROSPECTIVE,GO-007,2021-12-14,2022-08-15,2022-08-15,2021-12-15,,2022-10-18,"Miami Cancer Institute, Miami, Florida, 33176, United States|Advanced Research, Tamarac, Florida, 33321, United States|Astera Cancer Care, East Brunswick, New Jersey, 08816, United States|The Christ Hospital, Cincinnati, Ohio, 45219, United States|Sarah Cannon, Nashville, Tennessee, 37203, United States|Virginia Cancer Specialists, Fairfax, Virginia, 22031, United States",
NCT01055314,"Temozolomide, Cixutumumab, and Combination Chemotherapy in Treating Patients With Metastatic Rhabdomyosarcoma",https://clinicaltrials.gov/study/NCT01055314,,COMPLETED,"This randomized pilot clinical trial is studying the side effects and how well giving temozolomide and cixutumumab together with combination chemotherapy works in treating patients with metastatic rhabdomyosarcoma. Drugs used in chemotherapy, such as temozolomide, work in different ways to stop the growth of tumor cells, either by killing the cells or by stopping them from dividing. Monoclonal antibodies, such as cixutumumab, can block tumor growth in different ways. Some block the ability of tumor cells to grow and spread. Others find tumor cells and help kill them or carry tumor-killing substances to them. Giving temozolomide and cixutumumab together with combination chemotherapy may kill more tumor cells.",YES,Adult Rhabdomyosarcoma|Childhood Alveolar Rhabdomyosarcoma|Childhood Embryonal Rhabdomyosarcoma|Metastatic Childhood Soft Tissue Sarcoma|Stage IV Adult Soft Tissue Sarcoma|Untreated Childhood Rhabdomyosarcoma,BIOLOGICAL: Cixutumumab|DRUG: Cyclophosphamide|BIOLOGICAL: Dactinomycin|DRUG: Doxorubicin Hydrochloride|DRUG: Etoposide|DRUG: Ifosfamide|DRUG: Irinotecan Hydrochloride|OTHER: Laboratory Biomarker Analysis|DRUG: Temozolomide|DRUG: Vincristine Sulfate Liposome,"Feasibility of the Addition of Cixutumumab to Chemotherapy Determined by Patient Enrollment, Proportion of no Grade 3+ cardiac toxicity., From start to week 26 of therapy|Feasibility of the Addition of Temozolomide to Chemotherapy Determined by Patient Enrollment, Proportion of no Grade 4+ non-hematologic toxicity., From start to week 26 of therapy|Incidence of Adverse Events Assessed by Common Terminology Criteria for Adverse Events Version 4.0, Number of patients with grade 3+ adverse events (AE) during therapy. (Grade 3+) = (Grade 3 + Grade 4 + Grade 5) . Grade 3: Severe and undesirable AE; Grade 4: Life threatening or disabling AE; Grade 5: Death related to AE., Up to 54 weeks|Event-Free Survival, Probability of no relapse, secondary malignancy, or death after 3 years in the study., 3 years","Response Rate (CR + PR), Proportion of patients with complete or partial response. Complete Response (CR): Complete disappearance of the tumor confirmed at \> 4 weeks. Partial Response (PR): At least 64% decrease in volume compared to the measurement obtained at study enrollment; Overall Response (OR) = CR + PR., From the start of treatment until a maximum of 2 cycles (21 days per cycle) of treatment in the absence of disease progression or unacceptable toxicities",,National Cancer Institute (NCI),,ALL,"CHILD, ADULT",PHASE2,175,NIH,INTERVENTIONAL,Allocation: RANDOMIZED | Intervention Model: PARALLEL | Masking: NONE | Primary Purpose: TREATMENT,NCI-2011-02005|NCI-2011-02005|COG-ARST08P1|ARST08P1|ARST08P1|U10CA180886|U10CA098543,2010-01,2016-06,2016-06,2010-01-25,2017-07-28,2017-08-29,"Children's Hospital of Alabama, Birmingham, Alabama, 35233, United States|University of Alabama at Birmingham Cancer Center, Birmingham, Alabama, 35233, United States|Phoenix Childrens Hospital, Phoenix, Arizona, 85016, United States|Arkansas Children's Hospital, Little Rock, Arkansas, 72202-3591, United States|Southern California Permanente Medical Group, Downey, California, 90242, United States|Miller Children's and Women's Hospital Long Beach, Long Beach, California, 90806, United States|Children's Hospital Los Angeles, Los Angeles, California, 90027, United States|David Geffen School of Medicine at UCLA, Los Angeles, California, 90095, United States|Mattel Children's Hospital UCLA, Los Angeles, California, 90095, United States|Children's Hospital Central California, Madera, California, 93636-8762, United States|Children's Hospital and Research Center at Oakland, Oakland, California, 94609-1809, United States|Kaiser Permanente-Oakland, Oakland, California, 94611, United States|Childrens Hospital of Orange County, Orange, California, 92868, United States|Lucile Packard Children's Hospital Stanford University, Palo Alto, California, 94304, United States|Rady Children's Hospital - San Diego, San Diego, California, 92123, United States|UCSF Medical Center-Parnassus, San Francisco, California, 94143, United States|Children's Hospital Colorado, Aurora, Colorado, 80045, United States|Rocky Mountain Hospital for Children-Presbyterian Saint Luke's Medical Center, Denver, Colorado, 80218, United States|Connecticut Children's Medical Center, Hartford, Connecticut, 06106, United States|Yale University, New Haven, Connecticut, 06520, United States|Alfred I duPont Hospital for Children, Wilmington, Delaware, 19803, United States|MedStar Georgetown University Hospital, Washington D.C., District of Columbia, 20007, United States|Children's National Medical Center, Washington D.C., District of Columbia, 20010, United States|Broward Health Medical Center, Fort Lauderdale, Florida, 33316, United States|Golisano Children's Hospital of Southwest Florida, Fort Myers, Florida, 33908, United States|Memorial Healthcare System - Joe DiMaggio Children's Hospital, Hollywood, Florida, 33021, United States|Nemours Children's Clinic-Jacksonville, Jacksonville, Florida, 32207, United States|Nemours Children's Hospital, Orlando, Florida, 32827, United States|Nemours Children's Clinic - Pensacola, Pensacola, Florida, 32504, United States|All Children's Hospital, St. Petersburg, Florida, 33701, United States|Saint Joseph's Hospital/Children's Hospital-Tampa, Tampa, Florida, 33607, United States|Saint Mary's Hospital, West Palm Beach, Florida, 33407, United States|Children's Healthcare of Atlanta - Egleston, Atlanta, Georgia, 30322, United States|University of Hawaii Cancer Center, Honolulu, Hawaii, 96813, United States|Saint Luke's Mountain States Tumor Institute, Boise, Idaho, 83712, United States|Lurie Children's Hospital-Chicago, Chicago, Illinois, 60611, United States|University of Chicago Comprehensive Cancer Center, Chicago, Illinois, 60637, United States|Loyola University Medical Center, Maywood, Illinois, 60153, United States|Saint Jude Midwest Affiliate, Peoria, Illinois, 61602, United States|Southern Illinois University, Springfield, Illinois, 62702, United States|Riley Hospital for Children, Indianapolis, Indiana, 46202, United States|Blank Children's Hospital, Des Moines, Iowa, 50309, United States|University of Kentucky/Markey Cancer Center, Lexington, Kentucky, 40536, United States|Kosair Children's Hospital, Louisville, Kentucky, 40202, United States|Tulane University Health Sciences Center, New Orleans, Louisiana, 70112, United States|Children's Hospital New Orleans, New Orleans, Louisiana, 70118, United States|Sinai Hospital of Baltimore, Baltimore, Maryland, 21215, United States|Johns Hopkins University/Sidney Kimmel Cancer Center, Baltimore, Maryland, 21287, United States|Walter Reed National Military Medical Center, Bethesda, Maryland, 20889-5600, United States|Dana-Farber Cancer Institute, Boston, Massachusetts, 02115, United States|C S Mott Children's Hospital, Ann Arbor, Michigan, 48109, United States|Wayne State University/Karmanos Cancer Institute, Detroit, Michigan, 48201, United States|Helen DeVos Children's Hospital at Spectrum Health, Grand Rapids, Michigan, 49503, United States|Bronson Methodist Hospital, Kalamazoo, Michigan, 49007, United States|Kalamazoo Center for Medical Studies, Kalamazoo, Michigan, 49008, United States|Children's Hospitals and Clinics of Minnesota - Minneapolis, Minneapolis, Minnesota, 55404, United States|University of Minnesota Medical Center-Fairview, Minneapolis, Minnesota, 55455, United States|Mayo Clinic, Rochester, Minnesota, 55905, United States|University of Mississippi Medical Center, Jackson, Mississippi, 39216, United States|The Childrens Mercy Hospital, Kansas City, Missouri, 64108, United States|Cardinal Glennon Children's Medical Center, St Louis, Missouri, 63104, United States|Washington University School of Medicine, St Louis, Missouri, 63110, United States|Saint John's Mercy Medical Center, St Louis, Missouri, 63141, United States|Nevada Cancer Research Foundation CCOP, Las Vegas, Nevada, 89106, United States|Hackensack University Medical Center, Hackensack, New Jersey, 07601, United States|Morristown Memorial Hospital, Morristown, New Jersey, 07962, United States|UMDNJ - Robert Wood Johnson University Hospital, New Brunswick, New Jersey, 08903, United States|Newark Beth Israel Medical Center, Newark, New Jersey, 07112, United States|Saint Joseph's Regional Medical Center, Paterson, New Jersey, 07503, United States|Overlook Hospital, Summit, New Jersey, 07902, United States|University of New Mexico Cancer Center, Albuquerque, New Mexico, 87106, United States|University of New Mexico, Albuquerque, New Mexico, 87106, United States|Albany Medical Center, Albany, New York, 12208, United States|The Steven and Alexandra Cohen Children's Medical Center of New York, New Hyde Park, New York, 11040, United States|New York University Langone Medical Center, New York, New York, 10016, United States|University of Rochester, Rochester, New York, 14642, United States|State University of New York Upstate Medical University, Syracuse, New York, 13210, United States|University of North Carolina at Chapel Hill, Chapel Hill, North Carolina, 27599, United States|Carolinas Medical Center, Charlotte, North Carolina, 28203, United States|Duke University Medical Center, Durham, North Carolina, 27710, United States|Wake Forest University Health Sciences, Winston-Salem, North Carolina, 27157, United States|Children's Hospital Medical Center of Akron, Akron, Ohio, 44308, United States|Cincinnati Children's Hospital Medical Center, Cincinnati, Ohio, 45229, United States|Rainbow Babies and Childrens Hospital, Cleveland, Ohio, 44106, United States|Cleveland Clinic Foundation, Cleveland, Ohio, 44195, United States|Nationwide Children's Hospital, Columbus, Ohio, 43205, United States|Dayton Children's Hospital, Dayton, Ohio, 45404, United States|Mercy Children's Hospital, Toledo, Ohio, 43608, United States|University of Oklahoma Health Sciences Center, Oklahoma City, Oklahoma, 73104, United States|Natalie Warren Bryant Cancer Center at Saint Francis, Tulsa, Oklahoma, 74136, United States|Legacy Emanuel Children's Hospital, Portland, Oregon, 97227, United States|Legacy Emanuel Hospital and Health Center, Portland, Oregon, 97227, United States|Oregon Health and Science University, Portland, Oregon, 97239, United States|Lehigh Valley Hospital - Muhlenberg, Bethlehem, Pennsylvania, 18017, United States|Penn State Hershey Children's Hospital, Hershey, Pennsylvania, 17033, United States|Children's Hospital of Philadelphia, Philadelphia, Pennsylvania, 19104, United States|Children's Hospital of Pittsburgh of UPMC, Pittsburgh, Pennsylvania, 15224, United States|Rhode Island Hospital, Providence, Rhode Island, 02903, United States|Medical University of South Carolina, Charleston, South Carolina, 29425, United States|Palmetto Health Richland, Columbia, South Carolina, 29203, United States|BI-LO Charities Children's Cancer Center, Greenville, South Carolina, 29605, United States|Greenville Cancer Treatment Center, Greenville, South Carolina, 29605, United States|Sanford USD Medical Center - Sioux Falls, Sioux Falls, South Dakota, 57117-5134, United States|East Tennessee Childrens Hospital, Knoxville, Tennessee, 37916, United States|St. Jude Children's Research Hospital, Memphis, Tennessee, 38105, United States|Vanderbilt University/Ingram Cancer Center, Nashville, Tennessee, 37232, United States|Driscoll Children's Hospital, Corpus Christi, Texas, 78411, United States|Medical City Dallas Hospital, Dallas, Texas, 75230, United States|UT Southwestern/Simmons Cancer Center-Dallas, Dallas, Texas, 75390, United States|Cook Children's Medical Center, Fort Worth, Texas, 76104, United States|Baylor College of Medicine, Houston, Texas, 77030, United States|Primary Children's Hospital, Salt Lake City, Utah, 84113, United States|University of Vermont College of Medicine, Burlington, Vermont, 05405, United States|Childrens Hospital-King's Daughters, Norfolk, Virginia, 23507, United States|Virginia Commonwealth University/Massey Cancer Center, Richmond, Virginia, 23298, United States|Seattle Children's Hospital, Seattle, Washington, 98105, United States|Providence Sacred Heart Medical Center and Children's Hospital, Spokane, Washington, 99204, United States|Mary Bridge Children's Hospital and Health Center, Tacoma, Washington, 98405, United States|West Virginia University Charleston, Charleston, West Virginia, 25304, United States|Saint Vincent Hospital, Green Bay, Wisconsin, 54301, United States|Midwest Children's Cancer Center, Milwaukee, Wisconsin, 53226, United States|Sydney Children's Hospital, Randwick, New South Wales, 2031, Australia|The Children's Hospital at Westmead, Westmead, New South Wales, 2145, Australia|Royal Brisbane and Women's Hospital, Herston, Queensland, 4029, Australia|Royal Children's Hospital-Brisbane, Herston, Queensland, 4029, Australia|Princess Margaret Hospital for Children, Perth, Western Australia, 6008, Australia|Alberta Children's Hospital, Calgary, Alberta, T3B 6A8, Canada|British Columbia Children's Hospital, Vancouver, British Columbia, V6H 3V4, Canada|CancerCare Manitoba, Winnipeg, Manitoba, R3E 0V9, Canada|IWK Health Centre, Halifax, Nova Scotia, B3J 3G9, Canada|McMaster Children's Hospital at Hamilton Health Sciences, Hamilton, Ontario, L8N 3Z5, Canada|Chedoke-McMaster Hospitals, Hamilton, Ontario, L8S 4L8, Canada|Children's Hospital of Eastern Ontario, Ottawa, Ontario, K1H 8L1, Canada|Hospital for Sick Children, Toronto, Ontario, M5G 1X8, Canada|The Montreal Children's Hospital of the MUHC, Montreal, Quebec, H3H 1P3, Canada|Centre Hospitalier Universitaire Sainte-Justine, Montreal, Quebec, H3T 1C5, Canada|Saskatoon Cancer Centre, Saskatoon, Saskatchewan, S7N 4H4, Canada|Centre Hospitalier Universitaire de Quebec, Québec, G1V 4G2, Canada|Starship Children's Hospital, Grafton, Auckland, 1145, New Zealand",
NCT06617416,A Study of AK104 in Subjects With Unresectable Locally Advanced NSCLC,https://clinicaltrials.gov/study/NCT06617416,,RECRUITING,"This study compares the efficacy and safety of AK104 versus Sugemalimab as consolidation therapy in patients with unresectable, locally advanced NSCLC who have not progressed following concurrent or sequential chemoradiotherapy.",NO,NSCLC (Non-small Cell Lung Cancer),DRUG: Cadonilimab (AK104)|DRUG: Sugemalimab,"Progression-free survival (PFS) assessed by INV, PFS is defined as the time from randomization until the first documentation of disease progression or death due to any cause, whichever occurs first (based on RECIST Version 1.1)., 3 years","OS, Time from randomization to death, 5 years|6-month PFS rate assessed by INV, PFS rate at 6 months, 3 years|AEs, Adverse events incidence and severity, clinically significant abnormal laboratory test results., 3 years",,Akeso,,ALL,"ADULT, OLDER_ADULT",PHASE3,560,INDUSTRY,INTERVENTIONAL,"Allocation: RANDOMIZED | Intervention Model: PARALLEL | Masking: QUADRUPLE (PARTICIPANT, CARE_PROVIDER, INVESTIGATOR, OUTCOMES_ASSESSOR) | Primary Purpose: TREATMENT",AK104-309,2024-11-12,2026-10-28,2028-12-30,2024-09-27,,2025-03-12,"Cancer Hospital of Shandong First Medical University, Jinan, China",
NCT03208816,Community-Led Action Research in Oncology: Improving Symptom Management,https://clinicaltrials.gov/study/NCT03208816,CLARO,COMPLETED,"This study will be conducted at La Liga Contra el Cancer in San Pedro Sula, Honduras. The overall objective of this project is to improve symptom management for patients undergoing chemotherapy in Honduras. The first step in this line of research is a ""proof of concept"" feasibility study in which the investigators will demonstrate their ability to train nurses to administer a non-pharmacological, telephone-delivered, symptom management program for chemotherapy patients.",NO,Chemotherapy-induced Neutropenia|Chemotherapy-induced Nausea and Vomiting|Anxiety|Depression|Fatigue|Neoplasms,BEHAVIORAL: symptom management program for chemotherapy patients,"Recruitment feasibility, Number patients enrolled in the study divided by number of patients referred to the study, Through study completion , an average of one year","Intervention feasibility, Average number of minutes for each telephone sessions, Through study completion, an average of one year|Fidelity to treatment, Average fidelity score for rated telephone sessions, Through study completion, an average of one year|Acceptability of intervention, Semi-structured interview of patients and nurse interventionists, At study completion, approximately one year|Healthcare utilization, Average number of cancelled appointments, emergency room visits, and toxicity requiring change in treatment plan, 12 weeks after enrollment",,Dartmouth-Hitchcock Medical Center,,ALL,"ADULT, OLDER_ADULT",NA,25,OTHER,INTERVENTIONAL,Allocation: NA | Intervention Model: SINGLE_GROUP | Masking: NONE | Primary Purpose: SUPPORTIVE_CARE,CPHS30340,2017-07-24,2017-12-31,2017-12-31,2017-07-06,,2018-03-27,"Dartmouth-Hitchcock Medical Center, Lebanon, New Hampshire, 03756, United States|La Liga Contra el Cancer, San Pedro Sula, Honduras",
NCT03231306,Phase II Study of Binimetinib in Children and Adults With NF1 Plexiform Neurofibromas,https://clinicaltrials.gov/study/NCT03231306,NF108-BINI,COMPLETED,"This is a phase II open label study that will evaluate children ≥ 1 year of age and adults with neurofibromatosis type 1 (NF1) and plexiform neurofibromas treated with the MEK inhibitor, binimetinib. The primary objective is to determine if there is an adequate level of disease responsiveness to binimetinib in children and adults with NF1 and inoperable plexiform neurofibromas. The objective response to binimetinib is defined as ≥ 20% decrease in tumor volume reduction by 12 courses.",YES,Neurofibromatosis Type 1|Plexiform Neurofibroma,DRUG: Binimetinib,"Change From Baseline Target Tumor Volume at 12 Months, To determine the objective response defined as 20% or greater tumor volume reduction. Patients will undergo volumetric assays of their target PN using MRI., Approximately 12 months","Incidence of Treatment-Emergent Adverse Events, To evaluate the toxicity of protracted binimetinib administration in this patient population. Subjects will be monitored continuously for adverse events and serious adverse events throughout the study., Up to 24 months",,University of Alabama at Birmingham,Array BioPharma|Pacific Pediatric Neuro-Oncology Consortium,ALL,"CHILD, ADULT, OLDER_ADULT",PHASE2,45,OTHER,INTERVENTIONAL,Allocation: NA | Intervention Model: SINGLE_GROUP | Masking: NONE | Primary Purpose: TREATMENT,IRB-170616001|516027,2017-11-28,2024-04-17,2024-04-17,2017-07-27,2025-05-02,2025-05-02,"University of Alabama at Birmingham, Birmingham, Alabama, 35294, United States|Children's Hospital of Los Angeles, Los Angeles, California, 90027, United States|University of California at Los Angeles, Los Angeles, California, 90095, United States|UCSF Benioff Children's Hospital Oakland, Oakland, California, 94609, United States|University of California, San Diego - Rady Children's Hospital, San Diego, California, 92123, United States|University of California, San Francisco, San Francisco, California, 94153, United States|Children's National Medical Center, Washington D.C., District of Columbia, 20010, United States|Lurie Children's Hospital of Chicago, Chicago, Illinois, 60611, United States|University of Chicago, Chicago, Illinois, 60637, United States|Indiana University, Indianapolis, Indiana, 46202, United States|Johns Hopkins University, Baltimore, Maryland, 21287, United States|National Institute of Health - National Cancer Institute, Bethesda, Maryland, 20892, United States|Boston Children's Hospital / Dana Farber Cancer Institute / Massachusetts General Hospital, Boston, Massachusetts, 02115, United States|Washington University School of Medicine, St Louis, Missouri, 63110, United States|New York University Medical Center, New York, New York, 10016, United States|Cinncinnati Children's Hospital Medical Center, Cincinnati, Ohio, 45229, United States|Nationwide Children's Hospital, Columbus, Ohio, 43205, United States|Ohio State University, Columbus, Ohio, 43210, United States|Oregon Health and Science University Hospital, Portland, Oregon, 97239, United States|Children's Hospital of Philadelphia, Philadelphia, Pennsylvania, 19096, United States|University of Utah, Salt Lake City, Utah, 84132, United States|University of Washington - Seattle Children's Hospital, Seattle, Washington, 98105, United States","Study Protocol and Statistical Analysis Plan, https://cdn.clinicaltrials.gov/large-docs/06/NCT03231306/Prot_SAP_000.pdf|Informed Consent Form, https://cdn.clinicaltrials.gov/large-docs/06/NCT03231306/ICF_001.pdf"
